{"$schema":"https://json-schema.org/draft/2020-12/schema","type":"object","required":["schemaVersion","implementationSha","platform","workflowRun","qualityJob","buildJob","artifact","gates"],"properties":{"schemaVersion":{"const":1},"implementationSha":{"const":"67d60df66e9b45fe7a0ea326a86f5d96e14354fe"},"platform":{"type":"object","required":["workflowLabel","architecture"],"properties":{"workflowLabel":{"const":"macos-15-intel"},"architecture":{"const":"x86_64"}}},"workflowRun":{"type":"object","required":["id","url","status"],"properties":{"id":{"const":30323970497},"url":{"const":"https://github.com/adamshen1007/RTB-Publishing/actions/runs/30323970497"},"status":{"const":"passed"}}},"qualityJob":{"type":"object","required":["id","url","status"],"properties":{"id":{"const":90165388216},"url":{"const":"https://github.com/adamshen1007/RTB-Publishing/actions/runs/30323970497/job/90165388216"},"status":{"const":"passed"}}},"buildJob":{"type":"object","required":["id","url","status"],"properties":{"id":{"const":90165966469},"url":{"const":"https://github.com/adamshen1007/RTB-Publishing/actions/runs/30323970497/job/90165966469"},"status":{"const":"passed"}}},"artifact":{"type":"object","required":["name","retentionDays","status"],"properties":{"name":{"const":"pdf-compatibility-67d60df66e9b45fe7a0ea326a86f5d96e14354fe"},"retentionDays":{"const":14},"status":{"const":"uploaded"}}},"gates":{"type":"object","required":["pdfCompatibilityFixture","pdfCompatibilityEvidenceUpload","quality","buildPublishingArtifacts"],"properties":{"pdfCompatibilityFixture":{"const":"passed"},"pdfCompatibilityEvidenceUpload":{"const":"passed"},"quality":{"const":"passed"},"buildPublishingArtifacts":{"const":"passed"}}}}}
